No,質問,期待回答,実際回答,スコア,判定
0,Wi-Fiの周波数・設定について,ご利用場所により、異なります。\n\n2.4GHzの利用\n通信距離が広く、障害物(壁や床など)に強い特徴があるため、ルーターとの距離が離れる場合(ルーターと離れた部屋、階数が違う部屋)でご利用の場合、おすすめします。\n\n5GHzの利用\n通信距離が狭く、障害物(壁や床など)に弱い特徴があるため、ルーターの近くで接続できる場合のご利用をおすすめします。,"お問い合わせありがとうございます。
Wi-Fiの周波数と設定についてご案内いたします。

Wi-Fiには主に「2.4GHz」と「5GHz」という2つの周波数帯があり、それぞれに特徴があります。

*   **2.4GHz**
    *   壁や床などの障害物に強く、遠くまで電波が届きやすいです。
    *   ルーターと違う部屋でWi-Fiを利用する場合におすすめです。
    *   ただし、電子レンジなど他の家電と電波が干渉することがあります。

*   **5GHz**
    *   通信速度が速く、他の家電からの電波干渉を受けにくいです。
    *   ルーターの近くで動画視聴など、安定した高速通信を行いたい場合に適しています。
    *   一方で、壁などの障害物には弱い特性があります。

ご利用の場所や状況に応じて、より快適に通信できる方の周波数帯に接続していただくのがおすすめです。

また、新しいパソコンやスマートフォンにWi-Fiを設定する方法については、以下のリンクをご参照ください。端末側の操作のみで設定が完了します。

*   **Windows:** https://support.microsoft.com/ja-jp/windows/windows-%E3%81%A7-wi-fi-%E3%83%8D%E3%83%83%E3%83%88%E3%83%AF%E3%83%BC%E3%82%AF%E3%81%AB%E6%8E%A5%E7%B6%9A%E3%81%99%E3%82%8B-1f881677-b569-0cd5-010d-e3cd3579d263
*   **Android:** https://support.google.com/android/answer/9075847?hl=ja
*   **iPhone:** https://support.apple.com/ja-jp/111107

ご不明な点がございましたら、お気軽にお尋ねください。",0.852,〇
1,各種サービスの解約にかかる費用を教えて下さい。,ご利用のサービス、ご利用期間、申込時期により異なります。\n詳しくは、ご契約者様ご本人から0120-36-3624までお問い合せください。,"お問い合わせいただきありがとうございます。
各種サービスの解約費用についてですね。

申し訳ございません。お調べいたしましたが、解約費用に関する情報が見つかりませんでした。

解約にかかる費用は、ご契約のサービス内容や契約期間によって異なる場合がございます。
大変恐れ入りますが、詳細につきましては、担当部署へお問い合わせいただくか、ご契約内容をご確認いただけますでしょうか。",0.0,×
2,パソコン・スマートフォンを買い替えました。手続きや、設定方法を教えてください。,回線側の設定は特に必要ありません。\n買い換えた端末側の設定が必要となります。\n下記、参考URLとなります。\n\nパソコン\n(Microsoft参考URL)\nhttps://support.microsoft.com/ja-jp/windows/windows-%E3%81%A7-wi-fi-%E3%83%8D%E3%83%83%E3%83%88%E3%83%AF%E3%83%BC%E3%82%AF%E3%81%AB%E6%8E%A5%E7%B6%9A%E3%81%99%E3%82%8B-1f881677-b569-0cd5-010d-e3cd3579d263 \n\nAndroid\n(Google参考URL)\nhttps://support.google.com/android/answer/9075847?hl=ja \n\niPhone\n(Apple参考URL)\nhttps://support.apple.com/ja-jp/111107,"お問い合わせいただき、ありがとうございます。
パソコンやスマートフォンを新しくされたのですね。

お問い合わせいただいた機種変更時の手続きや設定方法について、お調べいたしましたが、あいにくご案内できる情報が見つかりませんでした。大変申し訳ございません。

一般的なご案内となりますが、新しい端末で会社のメールや各種アプリケーション（チャットツール、認証アプリなど）をご利用になるには、再設定が必要な場合がございます。

お手数をおかけいたしますが、詳細な設定方法につきましては、社内の情報システム担当部署へお問い合わせいただけますでしょうか。

何卒よろしくお願い申し上げます。",0.0,×
3,スリム光の初期費用を教えてください。,契約料 880円 引込工事料金が22000円となります。\nひかり電話・スリムテレビがある場合、別途費用がかかります。,"お問い合わせいただき、ありがとうございます。

申し訳ございません。お問い合わせいただいたスリム光の初期費用に関する情報が見つかりませんでした。
恐れ入りますが、料金の詳細につきましては、担当部署へお問い合わせいただけますでしょうか。

お手数をおかけいたしますが、よろしくお願い申し上げます。",0.0,×
4,料金未納により、電話・インターネットが使えなくなったので、支払いをして利用を再開したい,未納分の料金をお支払い後、1時間程度でご利用を再開できます。\n平日 10時〜19時 土曜日 10時〜17時までにお問合せください。,"お問い合わせいただきありがとうございます。
料金未納により電話やインターネットがご利用できず、ご不便をおかけしております。

お支払期限が過ぎてしまった料金につきましては、後日、新しいお支払用紙が自動的に再送されます。
お手数ですが、そちらのお支払用紙にて料金をお支払いいただきますようお願いいたします。

当社にてご入金の確認が取れ次第、順次サービスの利用を再開させていただきます。

もし、お支払用紙が届かない場合や、お急ぎの場合は、担当部署にてご状況を確認いたしますので、お申し付けください。",0.785,〇
5,料金未納で、至急支払いをしたい。振込先の口座を教えて欲しい,0120-36-3624までお問い合わせください。,"お問い合わせいただき、ありがとうございます。
料金のお支払いについて、ご心配をおかけしております。

お支払期限が過ぎてしまった場合、請求書は後日自動的に再送されるシステムとなっております。
お手数ですが、再送された請求書に記載の方法でお支払いいただけますでしょうか。

もし、請求書の再送をお待ちいただくことが難しい場合や、その他ご不明な点がございましたら、担当部署にて個別に対応させていただきますので、その旨をお知らせください。

何卒よろしくお願い申し上げます。",0.627,×
6,お引越し先でも使えるかどうかを知りたい,スリム光サービスはNTT東西のフレッツ光と同じ提供エリアとなります。\n下記、URLにて提供判断をすることができます。\n\nhttps://bb-fletsnavi.com/westlp/nttwest/index.html?vd=g1_5_2&gad_source=1&gad_campaignid=22613274467&gbraid=0AAAAA_yDh7HgPrwXQE2cYcWahoCyurNme&gclid=CjwKCAjwiY_GBhBEEiwAFaghvtjmVM4oU-xi7ssgbMYWBRYK9are89Qbfbe5Lxl9ClEqKatp88o05hoCSl0QAvD_BwE,"お問い合わせいただきありがとうございます。
お引越し先でのご利用についてですね。

お引越し先がサービスの提供エリア内かどうかを確認する必要がございます。
ご住所によってご利用可否が異なりますので、お手数ですが、以下の窓口までお問い合わせいただき、お引越し先のご住所をお知らせください。
担当者がご利用可能かお調べいたします。

【お問い合わせ窓口】
電話番号: 0120-36-3624

お気軽にご連絡くださいませ。",0.587,×
7,固定IPについて教えてください,固定IPアドレスとは、インターネット接続時に常に同じIPアドレスを使用できるサービスです。\n当社では、月額1650円でご提供しております。(税込),"お問い合わせありがとうございます。

固定IPアドレスとは、インターネットへ接続する際に、常に同じIPアドレスを利用できるサービスのことです。
通常、インターネットに接続するたびにIPアドレスは変わることがありますが、固定IPサービスをご利用いただくと、いつでも同じIPアドレスで接続することが可能になります。

当社では、月額1,650円（税込）でこちらのサービスをご提供しております。

ご不明な点がございましたら、お気軽にお尋ねください。",0.786,〇
8,光回線の工事はどのようにしますか？,ご利用場所や建物により変わりますが、おおよそは下記のような工程になります。\n宅内工事(標準工事の場合) 所要時間:約1〜2時間\n\n①光ファイバーケーブルの引き込み\n電柱から光ファイバーを宅内へ引き込みます。\n存在の電話線・エアコンダクト・配管などを活用することが多い。\n必要に応じて壁に小さな穴があることもある。\n\n②光コンセントの設置\n室内に「光コンセント」(光回線終端装置)を設置。\n設置場所は、基本的には電話配線付近やWi-Fiルーターの設置場所を考慮します。\n回線終端装置(ONU)の設置,"お問い合わせいただきありがとうございます。
光回線の工事についてですね。

光回線の工事は、主に電柱から光ファイバーケーブルをお客様の建物内に引き込み、インターネットに接続するための機器（ONU）を設置する作業となります。

一般的な工事の流れは以下の通りです。

1.  **屋外工事**
    最寄りの電柱から、建物の外壁まで光ファイバーケーブルを引き込みます。

2.  **屋内工事**
    引き込んだケーブルを、電話線の配管やエアコンのダクトなどを利用して室内まで配線します。
    ※状況によっては、壁に小さな穴を開ける場合もございますが、その際は事前にご確認いたします。

3.  **機器の設置**
    室内に光コンセントとONU（光回線終端装置）を設置し、開通の確認を行います。

工事の際は、宅内での作業が発生するため、基本的にお客様のお立ち会いをお願いしております。作業時間は通常1〜2時間程度で完了いたします。

なお、建物の構造上の理由などにより、工事ができない場合もございます。
ご不明な点がございましたら、お気軽にお尋ねください。",0.936,〇
9,開通までどれくらい時間がかかりますか？(開通までの期間),概ね、お申込後から2週間〜2ケ月となります。\n※時期や地域により異なります。\n※春頃は引越しシーズンのため、通常よりもお日にちがかかります。,"お問い合わせありがとうございます。
開通までの期間についてですね。

光回線の開通までにかかる期間は、お申し込みいただいてから概ね**2週間から2ヶ月**が目安となります。

ただし、お住まいの地域や工事の状況、お申し込みの時期によって期間は変動いたします。
特に、春頃は引越しシーズンで混み合いますため、通常よりもお時間がかかる場合がございますので、あらかじめご了承ください。",0.882,〇
10,最低利用期間はありますか？,スリム光サービスの契約期間は、2年契約自動更新型となります。\n満了時以外の解約の場合は、定額制プランは5000円、電話のみのプランは2200円となります。\nまた、プラン変更時も違約金の対象となります。,"お問い合わせいただきありがとうございます。

申し訳ございませんが、お調べいたしましたが、「最低利用期間」に関する情報が見つかりませんでした。

恐れ入りますが、詳細につきましては担当部署、またはサポート窓口まで直接お問い合わせいただけますでしょうか。

お手数をおかけいたしますが、よろしくお願い申し上げます。",0.0,×
11,利用休止はできますか？,利用休止はありません。,"お問い合わせいただきありがとうございます。

誠に申し訳ございませんが、お調べいたしましたが、「利用休止」に関する情報が見つかりませんでした。

お手数をおかけいたしますが、詳細につきましてはサポート担当までお問い合わせいただけますでしょうか。",0.0,×
12,短期間も利用できますか？,短期間も利用できます。\nただし、契約期間満了時以外の解約の場合は解約金がかかります。,"お問い合わせいただきありがとうございます。
短期間のご利用についてですね。

申し訳ございません。お調べいたしましたが、あいにく短期間のご利用に関する情報を見つけることができませんでした。

お客様のご希望の期間など、詳細をお伺いした上でご案内できるかと存じますので、お手数ではございますが、担当窓口までお問い合わせいただけますでしょうか。

ご不便をおかけいたしますが、何卒よろしくお願い申し上げます。",0.81,〇
13,法人でも申込みはできますか？,個人・法人問わず申込み可能です,"はい、法人様でもお申し込みいただけます。

個人契約から法人契約への名義変更なども承っておりますので、ご安心ください。",0.815,〇
14,プロバイダー加入は必要ですか？,インターネットをご利用の場合は、必須となります。\nスリム光サービスは、基本的にプロバイダ料金も含まれた価格でございます。\nご利用とともに加入となりますので、ご安心ください。\n※電話のみの場合は、セットに含まれておりません。,"お問い合わせいただきありがとうございます。

はい、インターネットをご利用いただくためには、通常、回線契約とは別にプロバイダーとのご契約が必要でございます。

インターネットに接続するためには、「回線（道路）」と、その回線をインターネットの世界に繋ぐ「プロバイダー（出入口）」の両方が必要とお考えいただくと分かりやすいかもしれません。

サービスによっては回線とプロバイダーが一体となっているプランもございます。

ご不明な点がございましたら、お気軽にお尋ねください。",0.877,〇
15,転用番号はどのようにすればとれますか？,【取得方法】\n・インターネットからのご取得を検討されているお客様\n(西日本在住の方)\nhttps://flets-w.com/collabo/tenyou/entry/ \n(東日本在住の方)\nhttps://flets.com/app4/input/index/ ・電話でご取得を検討されているお客様\n(西日本在住の方)\n0120-553-104\n受付時間 9:00〜17:00 土日・祝日も営業(年末年始を除く)\n\n(東日本在住の方)\n0120-140-202\n受付時間 9:00〜17:00 土日・祝日も営業(年末年始を除く),"お問い合わせありがとうございます。
転用番号の取得方法についてですね。

恐れ入りますが、いただきました情報の中には転用番号の取得方法に関する記載がございませんでした。

一般的に、転用番号はNTT東日本またはNTT西日本の窓口で取得することができます。
お手数ですが、NTT東日本・西日本の公式サイトをご覧いただくか、専用の電話窓口へ直接お問い合わせくださいますようお願いいたします。

お手続きの際には、フレッツ光のお客様IDやご契約者様のお名前などが必要になる場合がございますので、事前にご準備いただくとスムーズです。

その他、ご不明な点がございましたらお気軽にお尋ねください。",0.739,〇
16,事業者変更番号がほしいです、どうすればいいですか？,当社より事業者変更番号を払い出しいたしますので、0120-36-3624までお問合せください。\n\n事業者変更時のトラブルの一例です。(実例)\n・事業者変更後、インターネットが繋がらなくなった。\n・聞いていた料金よりも高額になった。\n当社でできていたサポートが、変更先では受けれなくなった。\・何か事業者側に依頼をするときに、ガイダンスや手間がかかるようになった。\n・当社よりレンタルで提供していたサービスを返却しないといけなくなった。\n・解約金・事業者変更手数料が返金されない、または費用負担があるとは聞いていなかった。\n・事業者変更後、営業担当者と連絡が繋がらなくなった。\n\n事業者変更についてのご案内\n・発行までお時間が要します。\n・ご契約者以外の対応は致しかねます。\n・支払状況により発行致しかねる場合がございます。\n・成りすまし防止のため、期間を開けてご契約者様の固定電話(固定がない場合は、携帯電話)へご連絡し、ご説明後事業者変更番号を発行します。\n\n発行後は、郵送にてお手元に届きます。\n新しく変更される事業者様へご提出ください。,"お問い合わせいただき、ありがとうございます。
事業者変更承諾番号の発行をご希望とのこと、承知いたしました。

恐れ入りますが、事業者変更承諾番号の発行手続きにつきましては、お電話または会員さま専用サイトにて承っております。

大変お手数をおかけいたしますが、弊社カスタマーサポートまでご連絡いただけますでしょうか。
ご本人様確認後、番号を発行させていただきます。

ご不明な点がございましたら、お気軽にお尋ねください。",0.816,〇
17,IPv6とは何ですか,IPv6とは、インターネットプロトコルの第6版で、IPv4に続く次世代のインターネット通信の規格です。\n\n【IPv6の特徴】\nIPv4と比べてアドレスが128ビットに拡張されており、約340潤(かん)個のIPアドレスが使用可能です。\nIPv4の約43憶個と桁違いの差があり、地球上のあらゆるものをインターネットへ接続できる可能性があります。\nIPv4と比べて通信速度が速くなる可能性があります。\nIPoE方式による接続方式では、帯域幅の広い通信網を経由できるため、回線の混雑を避けることができます。\nIPSec(アイピーセック)という技術が組み込まれているため、セキュリティの改善につながります。,"ご質問ありがとうございます。

IPv6（アイピーブイシックス）とは、インターネットプロトコルの第6版で、現在広く使われているIPv4に続く、次世代のインターネット通信規格です。

主な特徴として、以下の3点が挙げられます。

*   **膨大なアドレス数**:
    IPv4のアドレスが約43億個であるのに対し、IPv6では約340潤（かん）個という桁違いに多いIPアドレスが利用可能です。これにより、あらゆる機器をインターネットに接続できる可能性が広がります。

*   **通信速度の向上**:
    「IPoE」という新しい接続方式を利用することで、混雑しにくい広い帯域の通信網を経由できるため、通信速度が速くなる可能性があります。

*   **セキュリティの改善**:
    「IPSec（アイピーセック）」という暗号化技術が標準で組み込まれているため、通信の安全性が向上します。

ご不明な点がございましたら、お気軽にお尋ねください。",0.933,〇
18,支払い方法を変更したい,請求書払い・口座振替・クレジット支払いの3種類からお選び頂けます。\n\n請求書払い手数料 275円\nご利用頂いた月の翌月中旬頃に毎月お手元に届きます。\n\n口座振替手数料 110円\nご利用頂いた月の翌月27日に引落\n\nクレジット支払い手数料 0円\n\n明細発行手数料 220円となります。,"お問い合わせいただき、ありがとうございます。
お支払い方法の変更をご希望とのこと、承知いたしました。

申し訳ございません。お調べいたしましたが、いただいた情報の中には、お支払い方法の変更に関する具体的なご案内が見つかりませんでした。

大変恐れ入りますが、詳細な手続きにつきましては、担当部署へ直接お問い合わせいただけますでしょうか。
お手数をおかけいたしますが、何卒よろしくお願い申し上げます。",0.0,×
19,電話回線の工事はしてもらえますか？,電話回線のみの工事でできます。\nスリムひかり電話ネクスト・スリムひかり電話ネクストAと2種類サービスがございます。\n\n-月額使用料金-\nスリムひかり電話ネクスト 2750円\nスリムひかり電話ネクスト 3850円※1\n税込\n1(ナンバーディスプレイ 440円・ボイスワープ 550円・キャッチホン 330円・迷惑電話お断りサービス 220円・ナンバーリクエスト 220円)\n\n契約期間は2年となり、満了以外の場合は2000円の解約金がかかります。,"お問い合わせいただきありがとうございます。

はい、電話回線の工事も承っております。

他社様にて工事ができないと判断された場合などでも、当社では光ファイバーを引き込むための配管工事といった付帯工事も行っております。

お客様の状況に合わせてご案内いたしますので、詳細につきましては、お手数ですが下記窓口までお気軽にお問い合わせください。

【お問い合わせ窓口】
0120-36-3624",0.777,〇
20,インターネットの速度が遅いので、改善したいです。,通信速度が遅くなる原因には、機器や回線、電波干渉、接続台数などさまざまな要因が考えられます。\n\n\再起動・Wi-Fiルーターの交換・位置変更・中継器の導入などで改善される場合がございます。\n\n【端末・機器側の問題】\nスマホ(パソコン)のストレージやメモリが不足している\nスマホ(パソコン)のOSがアップデートされていない\nスマホ本体(パソコン)やバッテリー劣化・故障している\n古い機種のスマホ(パソコン)を使っている\n\n【電波干渉の問題】\n電子レンジなどの電波を発する家電やBluetoothとの電波干渉\n5Gの電波が直進性が高いという特性\n電波が届かない\n\n【設定の問題】\nループ接続されている\n\n【接続台数】\nWi-Fiルーターごとに接続台数が決まっており、同時に利用してると通信速度が落ちる傾向がある,"インターネットの速度が遅いとのこと、ご不便をおかけしております。

速度が遅い場合、まずはお使いの通信機器を再起動することで改善されることがございます。
以下の手順でお試しいただけますでしょうか。

**【通信機器の再起動手順】**
1. ご利用のパソコンやスマートフォンの電源をお切りください。
2. 次に、Wi-Fiルーターの電源アダプターをコンセントから抜きます。
3. 最後に、ONU（光回線終端装置）の電源アダプターを抜きます。
4. 2〜3分ほどお待ちいただいた後、ONU → Wi-Fiルーター → パソコン・スマートフォンの順で電源を入れ直してください。

もし再起動しても改善されない場合は、以下のような点もご確認いただけますと幸いです。

*   **Wi-Fiルーターと端末の距離や障害物**
    ルーターとご利用端末の間に壁などの障害物がないか、距離が離れすぎていないかご確認ください。
*   **有線接続を試す**
    可能であれば、LANケーブルで直接接続し、速度が改善されるかお試しください。

上記の方法でも解決しない場合は、より詳しい状況をお伺いする必要がございますので、お手数ですが、担当部署へお問い合わせください。",0.937,〇
